{
  "project_info": {"project_name":"智慧校园数字化升级项目","industry":"教育","buyer":"示例市教育局","budget":"人民币 500 万元","timeline":"合同签订后 120 日","delivery_location":"示例市第一中学","key_dates":[{"name":"投标截止","date":"2026-09-30"},{"name":"开标","date":"2026-10-01"}],"project_scope":["私有化部署","统一身份认证","数据看板","三年运维"]},
  "mandatory_requirements": [
    {"requirement":"近三年两个教育行业信息化项目案例","type":"Qualification","importance":"Critical","evidence_text":"须提供近三年内两个教育行业信息化项目案例","risk_if_missing":"资格审查不通过","status":"Gap"},
    {"requirement":"ISO 27001 认证","type":"Security","importance":"Critical","evidence_text":"具备 ISO 27001 信息安全管理体系认证","risk_if_missing":"资格审查不通过","status":"Gap"},
    {"requirement":"不少于三年 7×24 运维","type":"Service","importance":"High","evidence_text":"提供不少于三年的 7×24 小时运维服务","risk_if_missing":"服务评分失分或响应偏离","status":"Gap"}
  ],
  "scoring_criteria": [{"scoring_area":"技术方案","weight":45,"requirement":"架构与实施方案","evaluation_method":"评审打分","response_readiness":"Partial"},{"scoring_area":"同类案例","weight":20,"requirement":"教育行业案例","evaluation_method":"评审打分","response_readiness":"Not Ready"},{"scoring_area":"服务方案","weight":15,"requirement":"三年 7×24 运维","evaluation_method":"评审打分","response_readiness":"Not Ready"},{"scoring_area":"报价","weight":20,"requirement":"合理报价","evaluation_method":"评审打分","response_readiness":"Partial"}],
  "gap_analysis": [{"tender_requirement":"两个教育行业案例","current_response":"一个教育行业案例","gap":"案例数量不足","risk_level":"High","suggested_action":"补充合规案例或评估联合体方案","manual_review_required":true},{"tender_requirement":"ISO 27001","current_response":"仅提供 ISO 9001","gap":"缺少要求资质","risk_level":"High","suggested_action":"核验集团资质可否授权使用；不能则 No-Bid","manual_review_required":true},{"tender_requirement":"三年 7×24 运维","current_response":"一年 8×5 运维","gap":"服务承诺不足","risk_level":"High","suggested_action":"确认交付与成本后补充服务承诺","manual_review_required":true}],
  "recommendation": {"decision":"Conditional Bid","rationale":"交付周期与核心产品基本匹配，但存在两项资格性风险与服务缺口，必须在投标前完成核验和补强。"},
  "manual_review_queue": ["ISO 27001 资质主体及授权有效性","教育行业案例是否满足口径","7×24 服务成本与承诺边界"]
}
